{
  "$schema": "https://json-schema.org/draft/2020-12/schema",
  "$id": "https://yomineko.dev/contracts/exam_item.schema.json",
  "title": "exam_item",
  "description": "One JLPT-style practice question, drawn from the corpus so every item is also findable in a lesson. The id prefix names the section, and each section has its own required shape.",
  "x-yomineko": {
    "entity": "exam_item",
    "records": 4867,
    "packing": "list",
    "glob": "corpus/exam_banks/n[0-9]_*.json",
    "stable_id_field": "id",
    "generated_by": "scripts/contracts/build_schemas.py from contracts/_shapes.json",
    "vocabulary_policy": "Types, nesting and `required` are measured from the data. Value sets are not: every `enum` here is either declared in a design document, parsed from the code that produces the value, or curated in build_schemas.py with its source named in x-vocabulary. See contracts/README.md."
  },
  "type": "object",
  "properties": {
    "accepted": {
      "type": "array",
      "items": {
        "type": "string"
      }
    },
    "ai_generated": {
      "$ref": "common.schema.json#/$defs/Provenance/properties/ai_generated"
    },
    "answer": {
      "type": "string"
    },
    "audio": {
      "type": "string",
      "pattern": "^(pending|[A-Za-z0-9_./-]+\\.(mp3|m4a|ogg|wav|opus))$",
      "description": "The audio asset, or the literal `pending` while the TTS pipeline (design/listening.md) has not produced it yet. The first real filename must not fail the build."
    },
    "correct": {
      "type": "string"
    },
    "distractors": {
      "type": "array",
      "items": {
        "type": "string"
      },
      "minItems": 2,
      "uniqueItems": true
    },
    "explanation": {
      "$ref": "common.schema.json#/$defs/LocaleText"
    },
    "grammar": {
      "type": "string"
    },
    "id": {
      "$ref": "common.schema.json#/$defs/StableId"
    },
    "layer": {
      "$ref": "common.schema.json#/$defs/Layer"
    },
    "level": {
      "$ref": "common.schema.json#/$defs/Level"
    },
    "needs_review": {
      "$ref": "common.schema.json#/$defs/Provenance/properties/needs_review"
    },
    "pieces": {
      "type": "array",
      "items": {
        "type": "string"
      }
    },
    "question": {
      "type": "string"
    },
    "reading": {
      "type": "string"
    },
    "review_status": {
      "type": "array",
      "description": "Human review verdicts that are still LIVE for this record: each one's content hash still matches the text it approved. Written by the exporter from research/derived/review_ledger.json, never by hand — an entry whose text was rewritten afterwards is stale and exports nothing, and a review_status the ledger does not justify is a hard failure (scripts/validate/validate_review_ledger.py). Absent on a record nobody has reviewed, which is why it is never required. See design/review_ledger.md.",
      "items": {
        "type": "object",
        "properties": {
          "field": {
            "type": "string",
            "minLength": 1,
            "description": "The reviewed field, or \"*\" for the whole record."
          },
          "locale": {
            "anyOf": [
              {
                "$ref": "common.schema.json#/$defs/Locale"
              },
              {
                "type": "null"
              }
            ],
            "description": "The locale reviewed; null for a locale-agnostic verdict."
          },
          "status": {
            "type": "string",
            "enum": [
              "approved",
              "rejected"
            ],
            "description": "The verdict a named reviewer recorded. Vocabulary owner: design — design/review_ledger.md. Widening it is an edit there, never a side effect of regenerating this schema from the data.",
            "x-vocabulary": {
              "owner": "design",
              "source": "design/review_ledger.md"
            }
          },
          "reviewed_by": {
            "type": "string",
            "minLength": 1,
            "description": "Who reviewed it. An anonymous approval is not a review, and the correction-rate metric is per person."
          },
          "approved_at": {
            "type": "string",
            "minLength": 1,
            "description": "When. Provenance and ordering only — approvals do not expire (APP_PLAN D4): a rewrite invalidates them, the calendar does not."
          },
          "content_hash": {
            "type": "string",
            "pattern": "^(sha256:)?[0-9a-fA-F]{8,64}$",
            "description": "The sha256 of exactly what was reviewed, so a reader can tell WHICH text was approved without the ledger."
          }
        },
        "required": [
          "field",
          "status",
          "reviewed_by",
          "approved_at",
          "content_hash"
        ],
        "additionalProperties": false
      }
    },
    "script": {
      "type": "array",
      "items": {
        "type": "object",
        "properties": {
          "speaker": {
            "type": "string",
            "enum": [
              "F1",
              "F2",
              "M1",
              "M2",
              "N"
            ],
            "description": "Locale-neutral speaker slot the TTS pipeline maps to a voice. Vocabulary owner: design — design/listening.md (speaker registry — dialogue voices plus narrator). Widening it is an edit there, never a side effect of regenerating this schema from the data.",
            "x-vocabulary": {
              "owner": "design",
              "source": "design/listening.md (speaker registry — dialogue voices plus narrator)"
            }
          },
          "text": {
            "type": "string"
          }
        },
        "additionalProperties": false
      }
    },
    "sentence": {
      "type": "string"
    },
    "source": {
      "$ref": "common.schema.json#/$defs/Provenance/properties/source"
    },
    "stem": {
      "type": "string"
    },
    "target": {
      "type": "string"
    },
    "vocab": {
      "type": "string"
    },
    "vocab_id": {
      "type": "integer",
      "minimum": 0
    },
    "wrong": {
      "type": "array",
      "items": {
        "type": "string"
      }
    }
  },
  "additionalProperties": false,
  "required": [
    "ai_generated",
    "id",
    "layer",
    "level",
    "needs_review",
    "source"
  ],
  "allOf": [
    {
      "title": "known section",
      "description": "Every item's id names one of the declared exam sections. A typo'd prefix would otherwise match no branch and be validated by the envelope alone.",
      "properties": {
        "id": {
          "pattern": "^(cf|gf|kr|lg|lp|lr|ls|lt|or|pp|rc|so|tg|us):"
        }
      }
    },
    {
      "title": "word-level multiple choice",
      "description": "kanji_reading / orthography: a word in isolation, four options. Applies to ids prefixed kr, or (1953 items). `required` is measured at 100% presence per prefix; the branch itself is declared in build_schemas.py.",
      "if": {
        "required": [
          "id"
        ],
        "properties": {
          "id": {
            "pattern": "^(kr|or):"
          }
        }
      },
      "then": {
        "required": [
          "ai_generated",
          "correct",
          "distractors",
          "explanation",
          "id",
          "layer",
          "level",
          "needs_review",
          "source",
          "stem",
          "vocab",
          "vocab_id"
        ]
      }
    },
    {
      "title": "multiple choice inside a sentence",
      "description": "context_fill / grammar_form: the gap sits in a real corpus sentence. Applies to ids prefixed cf, gf (1397 items). `required` is measured at 100% presence per prefix; the branch itself is declared in build_schemas.py.",
      "if": {
        "required": [
          "id"
        ],
        "properties": {
          "id": {
            "pattern": "^(cf|gf):"
          }
        }
      },
      "then": {
        "required": [
          "ai_generated",
          "correct",
          "distractors",
          "explanation",
          "id",
          "layer",
          "level",
          "needs_review",
          "sentence",
          "source",
          "stem"
        ]
      }
    },
    {
      "title": "ordering",
      "description": "sentence_order: the learner rebuilds the sentence from shuffled pieces. Applies to ids prefixed so (655 items). `required` is measured at 100% presence per prefix; the branch itself is declared in build_schemas.py.",
      "if": {
        "required": [
          "id"
        ],
        "properties": {
          "id": {
            "pattern": "^(so):"
          }
        }
      },
      "then": {
        "required": [
          "accepted",
          "ai_generated",
          "answer",
          "explanation",
          "id",
          "layer",
          "level",
          "needs_review",
          "pieces",
          "sentence",
          "source"
        ]
      }
    },
    {
      "title": "passage multiple choice",
      "description": "text_grammar / reading_comp: the item hangs off a reading passage, and the prompt is carried by `stem` or by `question` depending on the section. Applies to ids prefixed tg, rc (516 items). `required` is measured at 100% presence per prefix; the branch itself is declared in build_schemas.py.",
      "if": {
        "required": [
          "id"
        ],
        "properties": {
          "id": {
            "pattern": "^(tg|rc):"
          }
        }
      },
      "then": {
        "required": [
          "ai_generated",
          "correct",
          "distractors",
          "explanation",
          "id",
          "layer",
          "level",
          "needs_review",
          "reading",
          "source"
        ],
        "anyOf": [
          {
            "required": [
              "stem"
            ]
          },
          {
            "required": [
              "question"
            ]
          }
        ]
      }
    },
    {
      "title": "paraphrase",
      "description": "paraphrase: pick the sentence that means the same thing. Applies to ids prefixed pp (52 items). `required` is measured at 100% presence per prefix; the branch itself is declared in build_schemas.py.",
      "if": {
        "required": [
          "id"
        ],
        "properties": {
          "id": {
            "pattern": "^(pp):"
          }
        }
      },
      "then": {
        "required": [
          "ai_generated",
          "correct",
          "distractors",
          "id",
          "layer",
          "level",
          "needs_review",
          "sentence",
          "source",
          "stem",
          "target",
          "vocab",
          "vocab_id"
        ]
      }
    },
    {
      "title": "usage",
      "description": "usage: pick the sentence that uses the target word correctly. Applies to ids prefixed us (55 items). `required` is measured at 100% presence per prefix; the branch itself is declared in build_schemas.py.",
      "if": {
        "required": [
          "id"
        ],
        "properties": {
          "id": {
            "pattern": "^(us):"
          }
        }
      },
      "then": {
        "required": [
          "ai_generated",
          "correct",
          "id",
          "layer",
          "level",
          "needs_review",
          "sentence",
          "source",
          "target",
          "vocab",
          "vocab_id",
          "wrong"
        ]
      }
    },
    {
      "title": "listening",
      "description": "the five listening sections: a spoken script, its audio, and options. Applies to ids prefixed lt, lp, ls, lr, lg (239 items). `required` is measured at 100% presence per prefix; the branch itself is declared in build_schemas.py.",
      "if": {
        "required": [
          "id"
        ],
        "properties": {
          "id": {
            "pattern": "^(lt|lp|ls|lr|lg):"
          }
        }
      },
      "then": {
        "required": [
          "ai_generated",
          "audio",
          "correct",
          "distractors",
          "id",
          "layer",
          "level",
          "needs_review",
          "question",
          "script",
          "source"
        ]
      }
    }
  ]
}
