[{"id": "rc:n5:n5-adjetivos-04-01", "level": "n5", "reading": "read:n5-adjetivos-04-01", "question": "えいがとくだものは、どうでしたか。", "correct": "えいがはおもしろくなくて、くだものはおいしかったです。", "distractors": ["えいがはおもしろくて、くだものはあまかったです。", "えいがはおもしろくて、くだものはおいしくなかったです。", "えいがはおもしろくなくて、くだものもおいしくなかったです。"], "explanation": {"pt-BR": "A resposta está nas frases 2 e 4: o filme não foi interessante, e a fruta, mesmo sem estar doce, estava muito gostosa. As outras opções ou elogiam o filme, ou dizem que a fruta estava doce, ou reprovam as duas coisas de uma vez, e nenhuma dessas leituras cabe no texto."}, "layer": "C", "needs_review": true, "source": "authored+verified", "ai_generated": false}, {"id": "rc:n5:n5-adjetivos-05-01", "level": "n5", "reading": "read:n5-adjetivos-05-01", "question": "この人はいつこうえんをさんぽしますか。", "correct": "すずしいあさに、いつもします。", "distractors": ["あめのあさに、ときどきします。", "さむいよるに、いつもします。", "あたたかいごごに、いつもします。"], "explanation": {"pt-BR": "A frase 2 amarra as duas informações: as manhãs ficaram frescas e é por isso que a pessoa sempre passeia no parque. Noite, tarde e dia de chuva não aparecem em lugar nenhum do texto, e o frio da frase 4 é o de amanhã, não a rotina."}, "layer": "C", "needs_review": true, "source": "authored+verified", "ai_generated": false}, {"id": "rc:n5:n5-adjetivos-06-01", "level": "n5", "reading": "read:n5-adjetivos-06-01", "question": "あにがすきなものと、きらいなものはなんですか。", "correct": "すきなのはスポーツで、きらいなのはうたです。", "distractors": ["すきなのはおんがくで、きらいなのはテレビです。", "すきなのはテレビで、きらいなのはおんがくです。", "すきなのはうたで、きらいなのはスポーツです。"], "explanation": {"pt-BR": "A frase 3 é a que conta os gostos do irmão mais velho: ele gosta de esporte e detesta canções. As outras opções invertem esse par ou colocam nele os gostos de quem narra, que são os das frases 1 e 2."}, "layer": "C", "needs_review": true, "source": "authored+verified", "ai_generated": false}, {"id": "rc:n5:n5-adjetivos-07-01", "level": "n5", "reading": "read:n5-adjetivos-07-01", "question": "どうして、いつも人がききに来ますか。", "correct": "ともだちのうたがとてもじょうずだからです。", "distractors": ["ともだちがおんがくのじかんに、人をよぶからです。", "ともだちがあたらしいうたをおぼえるからです。", "ともだちがクラスの前でテープをきくからです。"], "explanation": {"pt-BR": "A causa vem na frase 3: como a amiga canta bem, sempre aparece gente para ouvir. O texto nunca diz que ela chama alguém; aprender canções novas (frase 4) e a fita de música (frase 5) são outros fatos, e não o motivo da plateia."}, "layer": "C", "needs_review": true, "source": "authored+verified", "ai_generated": false}, {"id": "rc:n5:n5-adjetivos-08-01", "level": "n5", "reading": "read:n5-adjetivos-08-01", "question": "おかあさんがいちばんじょうずなことは、なんですか。", "correct": "ごはんをつくることです。", "distractors": ["うたをうたうことです。", "えをかくことです。", "かぞくとはなすことです。"], "explanation": {"pt-BR": "A frase 4 descarta cantar e desenhar para a mãe, e a frase 5 fecha dizendo que cozinhar é o que ela faz de melhor. Cantar bem é da irmã mais velha, desenhar é do irmão mais novo, e conversar com a família nem chega a ser citado."}, "layer": "C", "needs_review": true, "source": "authored+verified", "ai_generated": false}, {"id": "rc:n5:n5-comparacoes-04-01", "level": "n5", "reading": "read:n5-comparacoes-04-01", "question": "しろいねこがすきなのは、だれですか。", "correct": "この人とおかあさんです。", "distractors": ["かぞくみんなです。", "この人とおとうさんです。", "おかあさんとおとうさんです。"], "explanation": {"pt-BR": "Somando as frases 2 e 3, quem prefere gato branco é quem narra e a mãe. O pai fica de fora porque na frase 4 ele diz que prefere cachorro a gato, então nem dá para incluí-lo nem para dizer que a família inteira gosta."}, "layer": "C", "needs_review": true, "source": "authored+verified", "ai_generated": false}, {"id": "rc:n5:n5-comparacoes-05-01", "level": "n5", "reading": "read:n5-comparacoes-05-01", "question": "この人が今日いちばんさいごにすることは、なんですか。", "correct": "いえへかえることです。", "distractors": ["外でごはんをたべることです。", "がっこうへ行くことです。", "うみでおよぐことです。"], "explanation": {"pt-BR": "O texto está em ordem cronológica e a frase 5 é o último passo do dia: voltar para casa antes das cinco. A escola termina às três (frase 1), e nadar e comer na rua (frases 3 e 4) acontecem no meio, entre a escola e a volta para casa."}, "layer": "C", "needs_review": true, "source": "authored+verified", "ai_generated": false}, {"id": "rc:n5:n5-comparacoes-06-01", "level": "n5", "reading": "read:n5-comparacoes-06-01", "question": "この人は、どうしてコートをかいませんでしたか。", "correct": "ねだんが高すぎたからです。", "distractors": ["サイズが小さすぎたからです。", "コートがきれいではなかったからです。", "デパートがとおかったからです。"], "explanation": {"pt-BR": "A frase 2 dá o motivo: o casaco era caro demais, e por isso não foi comprado. Pequeno demais é o problema dos sapatos na frase 4, o próprio texto chama o casaco de bonito, e distância até a loja é assunto que nunca aparece."}, "layer": "C", "needs_review": true, "source": "authored+verified", "ai_generated": false}, {"id": "rc:n5:n5-conectando-04-01", "level": "n5", "reading": "read:n5-conectando-04-01", "question": "この人は、どうして今日学校を休みましたか。", "correct": "かぜをひいているからです。", "distractors": ["テストがきらいだからです。", "くすりがなかったからです。", "学校がやすみだったからです。"], "explanation": {"pt-BR": "A frase 2 explica a falta anunciada na frase 1: a pessoa está gripada desde ontem. O remédio ela já tomou (frase 3), o texto não fala em antipatia por prova, e a escola funcionou normalmente, tanto que houve prova (frase 5)."}, "layer": "C", "needs_review": true, "source": "authored+verified", "ai_generated": false}, {"id": "rc:n5:n5-conectando-05-01", "level": "n5", "reading": "read:n5-conectando-05-01", "question": "あした、この人はなにをしたほうがいいといっていますか。", "correct": "かさをもって行って、あたらしいようふくはきないほうがいいです。", "distractors": ["かさはもたないで、あたらしいようふくもきないほうがいいです。", "かさはもたないで、あたらしいようふくをきたほうがいいです。", "かさをもって行って、あたらしいようふくもきたほうがいいです。"], "explanation": {"pt-BR": "Os dois conselhos vêm juntos nas frases 2 e 3: levar guarda-chuva sim, vestir a roupa nova não. As outras opções acertam só metade do par ou invertem os dois lados."}, "layer": "C", "needs_review": true, "source": "authored+verified", "ai_generated": false}, {"id": "rc:n5:n5-conectando-06-01", "level": "n5", "reading": "read:n5-conectando-06-01", "question": "この人は、来月山でなにをするつもりですか。", "correct": "外でごはんを食べます。", "distractors": ["父とごはんを食べます。", "うちでごはんを食べます。", "電車の時間を見ます。"], "explanation": {"pt-BR": "A frase 4 diz o que a pessoa pretende fazer lá na montanha: comer ao ar livre. Conferir o horário do trem é o que ela faz na hora de sair (frase 5), comer com o pai é lembrança de infância (frase 3), e comer em casa contraria o próprio plano."}, "layer": "C", "needs_review": true, "source": "authored+verified", "ai_generated": false}, {"id": "rc:n5:n5-conectando-07-01", "level": "n5", "reading": "read:n5-conectando-07-01", "question": "この人は、日本語をどうおもっていますか。", "correct": "まだむずかしいですが、おもしろいです。", "distractors": ["かんたんですが、あまりおもしろくないです。", "むずかしくて、おもしろくないです。", "かんたんで、とてもおもしろいです。"], "explanation": {"pt-BR": "A última frase junta as duas impressões: ainda é difícil, mas é bem interessante. Nenhuma opção que chame o japonês de fácil ou que tire o interesse cabe aí."}, "layer": "C", "needs_review": true, "source": "authored+verified", "ai_generated": false}, {"id": "rc:n5:n5-convites-04-01", "level": "n5", "reading": "read:n5-convites-04-01", "question": "どうしてはやく出ますか。", "correct": "でんしゃに人がたくさんいるからです。", "distractors": ["きっぷをかうのに、時間がかかるからです。", "学校が午前八時にはじまるからです。", "川までのみちがとおいからです。"], "explanation": {"pt-BR": "O convite para sair cedo (frase 3) vem logo depois da frase 2, que diz que o trem fica cheio de gente, e é dali que sai o motivo. As passagens já são compradas hoje, oito da manhã é a hora do encontro e não do início da aula, e o texto não fala em distância."}, "layer": "C", "needs_review": true, "source": "authored+verified", "ai_generated": false}, {"id": "rc:n5:n5-convites-05-01", "level": "n5", "reading": "read:n5-convites-05-01", "question": "二人は、どうして三十分もあるきましたか。", "correct": "話がたのしかったからです。", "distractors": ["七時におきたからです。", "学校がとおかったからです。", "でんしゃがなかったからです。"], "explanation": {"pt-BR": "A frase 3 explica os trinta minutos pela conversa boa. O texto não diz que a escola é longe nem que faltou trem, e as sete da manhã são só o horário de acordar da frase 1."}, "layer": "C", "needs_review": true, "source": "authored+verified", "ai_generated": false}, {"id": "rc:n5:n5-convites-06-01", "level": "n5", "reading": "read:n5-convites-06-01", "question": "この人は、かばんのほかになにがほしいですか。", "correct": "セーターです。", "distractors": ["かばんです。", "かさです。", "くつです。"], "explanation": {"pt-BR": "A frase 5 diz que, na verdade, além da bolsa a pessoa também quer um suéter. A bolsa está no texto, mas a pergunta é justamente o que ela quer fora a bolsa, então essa opção não serve; guarda-chuva e sapato não aparecem em momento nenhum."}, "layer": "C", "needs_review": true, "source": "authored+verified", "ai_generated": false}, {"id": "rc:n5:n5-desu-wa-04-01", "level": "n5", "reading": "read:n5-desu-wa-04-01", "question": "おとうとのものは、どれですか。", "correct": "えんぴつといすです。", "distractors": ["かぎといすです。", "かぎとえんぴつです。", "かぎとえんぴつといすです。"], "explanation": {"pt-BR": "As frases 4 e 5 entregam o lápis e a cadeira ao irmão mais novo, e a frase 2 já tinha dado a chave ao irmão mais velho. Por isso nenhuma opção que inclua a chave funciona."}, "layer": "C", "needs_review": true, "source": "authored+verified", "ai_generated": false}, {"id": "rc:n5:n5-desu-wa-05-01", "level": "n5", "reading": "read:n5-desu-wa-05-01", "question": "「それ」は、だれですか。", "correct": "おばあさんです。", "distractors": ["おかあさんです。", "おじいさんです。", "おとうさんです。"], "explanation": {"pt-BR": "A pergunta com sore aparece na frase 3 e é corrigida na frase 4: não é a mãe, é a avó. Kore é que é a mãe (frases 1 e 2), are é o avô (frases 5 e 6), e o pai não entra na conversa."}, "layer": "C", "needs_review": true, "source": "authored+verified", "ai_generated": false}, {"id": "rc:n5:n5-numeros-tempo-04-01", "level": "n5", "reading": "read:n5-numeros-tempo-04-01", "question": "あめは十えんでいくつですか。", "correct": "十こです。", "distractors": ["二十こです。", "二こです。", "一こです。"], "explanation": {"pt-BR": "A frase 4 diz que a bala sai dez unidades por dez ienes. Duas unidades por dez ienes é o preço da fruta, na frase 5, e as outras quantidades não aparecem no aviso."}, "layer": "C"